{
  "summary": {
    "totalFindings": 2,
    "bySeverity": {
      "critical": 0,
      "error": 1,
      "warning": 0,
      "info": 1
    },
    "byRuleId": {
      "crypto.hash.weak": 1,
      "MW-003": 1
    },
    "byCategory": {
      "crypto": 1,
      "injection": 1,
      "api_inventory": 0
    },
    "findingsPerFile": {
      "c:\\Users\\Josh\\Downloads\\CyberSecurity\\benchmarks\\seeded\\crypto\\pos-weak-hash.js": 1,
      "c:\\Users\\Josh\\Downloads\\CyberSecurity\\benchmarks\\seeded\\injection\\pos-sql-concat.js": 1
    }
  },
  "routes": [
    {
      "method": "GET",
      "path": "/q",
      "fullPath": "/q",
      "params": [],
      "bodyFields": [],
      "queryFields": [
        "id"
      ],
      "paramsFields": [],
      "middlewares": [
        "anonymous"
      ],
      "file": "c:\\Users\\Josh\\Downloads\\CyberSecurity\\benchmarks\\seeded\\injection\\pos-sql-concat.js",
      "line": 4,
      "handlerSource": "(req, res) => {\r\n  const id = req.query.id;\r\n  const q = \"SELECT * FROM users WHERE id = '\" + id + \"'\";\r\n  res.send(q);\r\n}"
    }
  ],
  "routeInventory": [
    {
      "method": "GET",
      "path": "/q",
      "fullPath": "/q",
      "file": "c:\\Users\\Josh\\Downloads\\CyberSecurity\\benchmarks\\seeded\\injection\\pos-sql-concat.js",
      "line": 4,
      "middlewares": [
        "anonymous"
      ],
      "tags": [],
      "sensitivePath": false,
      "adminPath": false,
      "objectScoped": false,
      "hasAuthMiddleware": false
    }
  ],
  "findings": [
    {
      "ruleId": "crypto.hash.weak",
      "message": "Avoid weak hash algorithm 'md5'. For password storage use a password hashing function; for general hashing use SHA-256+.",
      "why": "MD5 and SHA-1 are cryptographically broken. If this hashes passwords, they are vulnerable to brute-force. For integrity/signatures use SHA-256 or SHA-3.",
      "fix": "For passwords: use bcrypt, scrypt, PBKDF2, or argon2 with salting (e.g. bcrypt.hashSync(password, 10)). For general hashing: crypto.createHash('sha256') or crypto.createHash('sha512').",
      "severity": "error",
      "severityLabel": "HIGH",
      "category": "crypto",
      "line": 3,
      "column": 10,
      "endLine": 3,
      "endColumn": 34,
      "file": "c:\\Users\\Josh\\Downloads\\CyberSecurity\\benchmarks\\seeded\\crypto\\pos-weak-hash.js",
      "filePath": "c:\\Users\\Josh\\Downloads\\CyberSecurity\\benchmarks\\seeded\\crypto\\pos-weak-hash.js",
      "ruleFamily": "crypto.hash"
    },
    {
      "ruleId": "MW-003",
      "message": "No helmet() call detected in this file ΓÇö verify security headers are set.",
      "why": "Without secure headers, apps are more vulnerable to XSS, clickjacking, and MIME sniffing.",
      "fix": "Use helmet() at app bootstrap or equivalent header middleware.",
      "severity": "info",
      "severityLabel": "LOW",
      "category": "injection",
      "cwe": 693,
      "owasp": "A05:2021",
      "findingKind": "APP_CONFIG",
      "line": 1,
      "column": 0,
      "file": "c:\\Users\\Josh\\Downloads\\CyberSecurity\\benchmarks\\seeded\\injection\\pos-sql-concat.js",
      "filePath": "c:\\Users\\Josh\\Downloads\\CyberSecurity\\benchmarks\\seeded\\injection\\pos-sql-concat.js",
      "ruleFamily": "middleware.headers"
    }
  ],
  "fileResults": [
    {
      "filePath": "c:\\Users\\Josh\\Downloads\\CyberSecurity\\benchmarks\\seeded\\crypto\\pos-weak-hash.js",
      "file": "c:\\Users\\Josh\\Downloads\\CyberSecurity\\benchmarks\\seeded\\crypto\\pos-weak-hash.js",
      "findings": [
        {
          "ruleId": "crypto.hash.weak",
          "message": "Avoid weak hash algorithm 'md5'. For password storage use a password hashing function; for general hashing use SHA-256+.",
          "why": "MD5 and SHA-1 are cryptographically broken. If this hashes passwords, they are vulnerable to brute-force. For integrity/signatures use SHA-256 or SHA-3.",
          "fix": "For passwords: use bcrypt, scrypt, PBKDF2, or argon2 with salting (e.g. bcrypt.hashSync(password, 10)). For general hashing: crypto.createHash('sha256') or crypto.createHash('sha512').",
          "severity": "error",
          "severityLabel": "HIGH",
          "category": "crypto",
          "line": 3,
          "column": 10,
          "endLine": 3,
          "endColumn": 34,
          "file": "c:\\Users\\Josh\\Downloads\\CyberSecurity\\benchmarks\\seeded\\crypto\\pos-weak-hash.js",
          "filePath": "c:\\Users\\Josh\\Downloads\\CyberSecurity\\benchmarks\\seeded\\crypto\\pos-weak-hash.js",
          "ruleFamily": "crypto.hash"
        }
      ],
      "routeCount": 0
    },
    {
      "filePath": "c:\\Users\\Josh\\Downloads\\CyberSecurity\\benchmarks\\seeded\\injection\\pos-sql-concat.js",
      "file": "c:\\Users\\Josh\\Downloads\\CyberSecurity\\benchmarks\\seeded\\injection\\pos-sql-concat.js",
      "findings": [
        {
          "ruleId": "MW-003",
          "message": "No helmet() call detected in this file ΓÇö verify security headers are set.",
          "why": "Without secure headers, apps are more vulnerable to XSS, clickjacking, and MIME sniffing.",
          "fix": "Use helmet() at app bootstrap or equivalent header middleware.",
          "severity": "info",
          "severityLabel": "LOW",
          "category": "injection",
          "cwe": 693,
          "owasp": "A05:2021",
          "findingKind": "APP_CONFIG",
          "line": 1,
          "column": 0,
          "file": "c:\\Users\\Josh\\Downloads\\CyberSecurity\\benchmarks\\seeded\\injection\\pos-sql-concat.js",
          "filePath": "c:\\Users\\Josh\\Downloads\\CyberSecurity\\benchmarks\\seeded\\injection\\pos-sql-concat.js",
          "ruleFamily": "middleware.headers"
        }
      ],
      "routeCount": 1
    }
  ],
  "run": {
    "toolVersion": "1.0.0",
    "timestamp": "2026-03-23T05:50:08.898Z",
    "gitCommit": "04e93ca69895834ca565af3516482c5d5771f538",
    "scanOptions": {
      "format": "json",
      "mode": "static",
      "excludeVendor": true,
      "checkRegistry": false,
      "skipRegistry": false,
      "crypto": true,
      "injection": true,
      "ignoreGlobs": [],
      "benchmarkMetadata": true
    }
  }
}
